ID,Customer Message,Agent Response
1,My order hasn’t arrived yet. Can you check?,I’m sorry for the delay! Can you provide your order number?
2,I need to reset my password but the link is broken.,I understand. Let me generate a new reset link for you.
3,Do you have a refund policy?,Yes! We offer a 30-day money-back guarantee. Would you like me to process a refund?
4,The product I received is defective.,I'm sorry to hear that. We can arrange a replacement or refund. What would you prefer?
5,How can I contact support?,You can reach us via email at support@example.com or call our helpline.
